{
  "candidate": {
    "block_index": 3,
    "coordinate_factor_abs": {
      "11": "9.989324202593793249896590466458407899884425234265960126286413E-1",
      "2": "1.000000000000000000000000000000000000000000000000000000000000E+0",
      "3": "9.999970825176402919816585154792134391798544579913546156493626E-1",
      "5": "9.988291306829543135785896897952469844904911689387605016816727E-1",
      "7": "9.985848551677221050833551974405140204194558663177287131355292E-1"
    },
    "crosscheck_abs_error": "1.856740859176687785318041511909797558006564477312194252722411E-15",
    "decimal_precision": 80,
    "direct_divisor_vector_phi_abs": "9.963479152311586000000000000000000000000000000000000000000000E-1",
    "divisor_vector_count": 792,
    "max_phase_residual_cycles": "1.693623219152402084848637854311280552860703109584785182354837E-2",
    "max_scaled_residual": "3.387246438304804169697275708622561105721406219169570364709674E-2",
    "n": 12,
    "phase_residual_cycles": {
      "11": "1.470970392902220478960021418305350546214343702477260679388316E-2",
      "2": "0E+0",
      "3": "2.251106451034330698333417620438755176898859795413289604543584E-4",
      "5": "9.434058281891462221921625369634011960864368963031194622881479E-3",
      "7": "1.693623219152402084848637854311280552860703109584785182354837E-2"
    },
    "phi_abs": "9.963479152311604567408591766877853180415119097975580065644773E-1",
    "q": 1161483,
    "q_block": [1000000, 2000000],
    "retained_finalist_count": 8,
    "scan_phi_abs_binary64": "0.99634791521867694",
    "selected_from_block_index": 3,
    "t": "1.052851850921974909517558014167966263335768834623247453301425E+7"
  },
  "evidence_sha256": "b15ad70a01046ec292ab3197faafc357bf4c9be155e97a5d498b10a6681123fc",
  "result_class": "computational evidence",
  "schema": "nova4.n3-characteristic-recurrence-candidate.v1",
  "sha256": "ab8e8a6d0aa24440ceb1379b86d9ae70dd02b2a5b263f4db4ea89eb354f49a24",
  "source": {
    "branch": "nova/analytic-density",
    "handoff": "N3-HO-N4-002",
    "handoff_commit": "7469dada02fa4caca08ed391ef8b0cb0f1e855b2",
    "object": "N3-ANA-007",
    "proof_commit": "ff57005b975c4917341306bd0eceb6d05a9b18f6",
    "proof_file": "tracks/nova3-analytic-density/proofs/PRODUCT_MODEL_THEOREMS.md",
    "repository": "Lumathpolgar/erdos18-factorial-program",
    "request": "D"
  }
}
